"acu_id","acu_text","acu_type","annotator","timestamp"
"1","Los vecinos de Aluche vemos día tras día como nuestro querido barrio está cada vez más sucio y descuidado.","major claim","andres.segura","2022/07/22 17:18:13"
"2","Graffitis y basura por todas partes, aceras rotas, baches en la carretera, zonas de jardines destrozadas.","claim","andres.segura","2022/07/22 17:18:13"
"3","No a los ruidos. Reducir el número de decibelios permitido.","premise","andres.segura","2022/07/22 17:18:13"
"4","Es un problema global lo de las pintadas descontroladas.","premise","andres.segura","2022/07/22 17:18:13"
"5","Que os parecería esto para el barrio.","premise","andres.segura","2022/07/22 17:18:13"
"6","Cuantos más votos, más conseguiremos.","premise","andres.segura","2022/07/22 17:18:13"
"7","Aprendamos a mantener limpia España.","premise","andres.segura","2022/07/22 17:18:13"
